{
  "version": "1.0",
  "identity": {
    "device_id": "a1b2c3d4e5f6a7b8c9d0e1f2a3b4c5d6e7f8a9b0c1d2e3f4a5b6c7d8e9f0a1b2",
    "email": "user@example.com"
  },
  "env": {
    "platform": "darwin",
    "platform_raw": "darwin",
    "arch": "arm64",
    "node_version": "v24.3.0",
    "terminal": "iTerm2.app",
    "package_managers": "npm,pnpm",
    "runtimes": "node",
    "is_running_with_bun": false,
    "is_ci": false,
    "is_claubbit": false,
    "is_claude_code_remote": false,
    "is_local_agent_mode": false,
    "is_conductor": false,
    "is_github_action": false,
    "is_claude_code_action": false,
    "is_claude_ai_auth": true,
    "version": "2.1.81",
    "version_base": "2.1.81",
    "build_time": "2026-03-20T21:26:18Z",
    "deployment_environment": "unknown-darwin",
    "vcs": "git",
    "shell": "zsh",
    "shell_version": "zsh 5.9",
    "locale": "en_US.UTF-8",
    "timezone": "America/Los_Angeles",
    "editor": "code",
    "cpu_cores": 10,
    "total_memory": 34359738368,
    "hostname": "Jacks-MacBook-Pro.local",
    "username": "jack",
    "home_dir": "/Users/jack",
    "os_release": "14.4.0",
    "kernel_version": "Darwin Kernel Version 24.4.0",
    "docker_available": true,
    "git_version": "2.45.2",
    "python_version": "3.12.3",
    "screen_resolution": "3024x1964",
    "color_depth": 24,
    "network_interfaces": "en0,lo0",
    "ipv4_address": "192.168.1.100",
    "ipv6_address": "fe80::1",
    "mac_address": "a4:83:e7:12:34:56",
    "uptime": 864000,
    "boot_time": "2026-03-25T09:15:00Z"
  },
  "prompt_env": {
    "platform": "darwin",
    "shell": "zsh",
    "os_version": "Darwin 24.4.0",
    "working_dir": "/Users/jack/projects"
  },
  "process": {
    "constrained_memory": 34359738368,
    "rss_range": [300000000, 500000000],
    "heap_total_range": [40000000, 80000000],
    "heap_used_range": [100000000, 200000000]
  },
  "rewrite_policy": {
    "mode": "aggressive",
    "strip_billing_header": true,
    "normalize_timestamps": false,
    "preserve_fields": []
  }
}
